{
  "schema_version": "rawflow.v1",
  "seq_id": 10482,
  "session_id": "fp_01HXY",
  "svc": "ftp",
  "provider_id": "vsftpd",
  "cell_id": "ftp-cell-01",
  "collector_id": "ftp-collector-a",
  "src_ip": "203.0.113.10",
  "src_port": 51820,
  "dst_ip": "172.30.30.10",
  "dst_port": 21,
  "transport": "tcp",
  "first_seen": "2026-10-05T08:32:11.123456789Z",
  "last_seen": "2026-10-05T08:32:14.100000000Z",
  "bytes_in": 240,
  "bytes_out": 410,
  "packet_count_in": 6,
  "packet_count_out": 7,
  "pcap_ref": "pcap/ftp/ring/20261005T0832.pcap",
  "parser_status": "recognized",
  "classification_status": "known",
  "protocol_guess": "ftp-control"
}
